{
  "schema_version": "2.0",
  "project": {
    "id": "案例C",
    "name": "案例C",
    "case_type": "urban_renewal"
  },
  "input": {
    "site": {
      "site_area_sqm": 960.0,
      "plaza_area_sqm": 0.0,
      "far": 2.25,
      "bonus_ratio": 0.86,
      "tdr_transfer_sqm": 0.0
    },
    "building": {
      "public_ratio": 0.33,
      "stair_hall_exempt_pct": 8,
      "balcony_exempt_pct": 10,
      "unit_count": 40
    },
    "floors": [
      {
        "enabled": true,
        "level": "1F",
        "floor_area_sqm": 336.0,
        "counted_far_sqm": 0.0,
        "stair_hall_sqm": 29.0,
        "safety_stair_sqm": 41.0,
        "balcony_sqm": 21.0
      },
      {
        "enabled": true,
        "level": "2F",
        "floor_area_sqm": 334.0,
        "counted_far_sqm": 0.0,
        "stair_hall_sqm": 14.5,
        "safety_stair_sqm": 41.0,
        "balcony_sqm": 35.5
      },
      {
        "enabled": true,
        "level": "3F",
        "floor_area_sqm": 334.0,
        "counted_far_sqm": 0.0,
        "stair_hall_sqm": 14.5,
        "safety_stair_sqm": 41.0,
        "balcony_sqm": 35.5
      },
      {
        "enabled": true,
        "level": "4F",
        "floor_area_sqm": 334.0,
        "counted_far_sqm": 0.0,
        "stair_hall_sqm": 14.5,
        "safety_stair_sqm": 41.0,
        "balcony_sqm": 35.5
      },
      {
        "enabled": true,
        "level": "5F",
        "floor_area_sqm": 334.0,
        "counted_far_sqm": 0.0,
        "stair_hall_sqm": 14.5,
        "safety_stair_sqm": 41.0,
        "balcony_sqm": 35.5
      },
      {
        "enabled": true,
        "level": "6F",
        "floor_area_sqm": 334.0,
        "counted_far_sqm": 0.0,
        "stair_hall_sqm": 14.5,
        "safety_stair_sqm": 41.0,
        "balcony_sqm": 35.5
      },
      {
        "enabled": true,
        "level": "7F",
        "floor_area_sqm": 334.0,
        "counted_far_sqm": 0.0,
        "stair_hall_sqm": 14.5,
        "safety_stair_sqm": 41.0,
        "balcony_sqm": 35.5
      },
      {
        "enabled": true,
        "level": "8F",
        "floor_area_sqm": 334.0,
        "counted_far_sqm": 0.0,
        "stair_hall_sqm": 14.5,
        "safety_stair_sqm": 41.0,
        "balcony_sqm": 35.5
      },
      {
        "enabled": true,
        "level": "9F",
        "floor_area_sqm": 334.0,
        "counted_far_sqm": 0.0,
        "stair_hall_sqm": 14.5,
        "safety_stair_sqm": 41.0,
        "balcony_sqm": 35.5
      },
      {
        "enabled": true,
        "level": "10F",
        "floor_area_sqm": 334.0,
        "counted_far_sqm": 0.0,
        "stair_hall_sqm": 14.5,
        "safety_stair_sqm": 41.0,
        "balcony_sqm": 35.5
      },
      {
        "enabled": true,
        "level": "11F",
        "floor_area_sqm": 334.0,
        "counted_far_sqm": 0.0,
        "stair_hall_sqm": 14.5,
        "safety_stair_sqm": 41.0,
        "balcony_sqm": 35.5
      },
      {
        "enabled": true,
        "level": "12F",
        "floor_area_sqm": 334.0,
        "counted_far_sqm": 0.0,
        "stair_hall_sqm": 14.5,
        "safety_stair_sqm": 41.0,
        "balcony_sqm": 35.5
      },
      {
        "enabled": true,
        "level": "13F",
        "floor_area_sqm": 334.0,
        "counted_far_sqm": 0.0,
        "stair_hall_sqm": 14.5,
        "safety_stair_sqm": 41.0,
        "balcony_sqm": 35.5
      },
      {
        "enabled": true,
        "level": "14F",
        "floor_area_sqm": 334.0,
        "counted_far_sqm": 0.0,
        "stair_hall_sqm": 14.5,
        "safety_stair_sqm": 41.0,
        "balcony_sqm": 35.5
      },
      {
        "enabled": true,
        "level": "15F",
        "floor_area_sqm": 334.0,
        "counted_far_sqm": 0.0,
        "stair_hall_sqm": 14.5,
        "safety_stair_sqm": 41.0,
        "balcony_sqm": 35.5
      }
    ],
    "finance": {
      "residential_price": 136.0,
      "shop_area": 60.0,
      "shop_price": 170.0,
      "parking_count": 48,
      "parking_price": 250.0,
      "construction_price": 24.0
    },
    "owners": [],
    "scenario": {
      "name": "baseline",
      "bonus_breakdown": {
        "更新基本": 0.5,
        "防災加成": 0.36
      }
    }
  },
  "engine": {
    "params": {
      "案件名稱": "案例C",
      "基地面積": 960.0,
      "人行廣場": 0.0,
      "容積率": 2.25,
      "獎勵率": 0.86,
      "容積移轉": 0.0,
      "公設比": 0.33,
      "梯廳免計基準": 8,
      "陽台免計基準": 10,
      "面積表計入容積": 4018.0,
      "住宅單價": 136.0,
      "店舖坪數": 60.0,
      "店舖單價": 170.0,
      "車位數": 48,
      "車位單價": 250.0,
      "營造單價": 24.0,
      "戶數": 40,
      "土融土地成本": 0.0
    },
    "floors": [
      {
        "啟用": true,
        "樓層": "1F",
        "樓板": 336.0,
        "計容積": 0.0,
        "梯廳": 29.0,
        "安全梯": 41.0,
        "陽台": 21.0
      },
      {
        "啟用": true,
        "樓層": "2F",
        "樓板": 334.0,
        "計容積": 0.0,
        "梯廳": 14.5,
        "安全梯": 41.0,
        "陽台": 35.5
      },
      {
        "啟用": true,
        "樓層": "3F",
        "樓板": 334.0,
        "計容積": 0.0,
        "梯廳": 14.5,
        "安全梯": 41.0,
        "陽台": 35.5
      },
      {
        "啟用": true,
        "樓層": "4F",
        "樓板": 334.0,
        "計容積": 0.0,
        "梯廳": 14.5,
        "安全梯": 41.0,
        "陽台": 35.5
      },
      {
        "啟用": true,
        "樓層": "5F",
        "樓板": 334.0,
        "計容積": 0.0,
        "梯廳": 14.5,
        "安全梯": 41.0,
        "陽台": 35.5
      },
      {
        "啟用": true,
        "樓層": "6F",
        "樓板": 334.0,
        "計容積": 0.0,
        "梯廳": 14.5,
        "安全梯": 41.0,
        "陽台": 35.5
      },
      {
        "啟用": true,
        "樓層": "7F",
        "樓板": 334.0,
        "計容積": 0.0,
        "梯廳": 14.5,
        "安全梯": 41.0,
        "陽台": 35.5
      },
      {
        "啟用": true,
        "樓層": "8F",
        "樓板": 334.0,
        "計容積": 0.0,
        "梯廳": 14.5,
        "安全梯": 41.0,
        "陽台": 35.5
      },
      {
        "啟用": true,
        "樓層": "9F",
        "樓板": 334.0,
        "計容積": 0.0,
        "梯廳": 14.5,
        "安全梯": 41.0,
        "陽台": 35.5
      },
      {
        "啟用": true,
        "樓層": "10F",
        "樓板": 334.0,
        "計容積": 0.0,
        "梯廳": 14.5,
        "安全梯": 41.0,
        "陽台": 35.5
      },
      {
        "啟用": true,
        "樓層": "11F",
        "樓板": 334.0,
        "計容積": 0.0,
        "梯廳": 14.5,
        "安全梯": 41.0,
        "陽台": 35.5
      },
      {
        "啟用": true,
        "樓層": "12F",
        "樓板": 334.0,
        "計容積": 0.0,
        "梯廳": 14.5,
        "安全梯": 41.0,
        "陽台": 35.5
      },
      {
        "啟用": true,
        "樓層": "13F",
        "樓板": 334.0,
        "計容積": 0.0,
        "梯廳": 14.5,
        "安全梯": 41.0,
        "陽台": 35.5
      },
      {
        "啟用": true,
        "樓層": "14F",
        "樓板": 334.0,
        "計容積": 0.0,
        "梯廳": 14.5,
        "安全梯": 41.0,
        "陽台": 35.5
      },
      {
        "啟用": true,
        "樓層": "15F",
        "樓板": 334.0,
        "計容積": 0.0,
        "梯廳": 14.5,
        "安全梯": 41.0,
        "陽台": 35.5
      }
    ],
    "case_type": "都更",
    "mode": "全案管理",
    "owners": []
  },
  "result": {
    "baseline_far": 2160.0,
    "allow_floor_area": 4017.6,
    "used_floor_area": 4049.52,
    "remaining_floor_area": -31.92,
    "stair_exempt_cap": 602.64,
    "balcony_exempt_area": 488.6,
    "saleable_area": 2054.85,
    "efficiency_ratio": 1.691,
    "total_sales": 293500.0,
    "shared_cost": 87232.0,
    "shared_cost_ratio": 0.2972,
    "owner_return_value": 206268.0,
    "owner_return_ratio": 0.7028,
    "return_rate": 2.3646,
    "warnings": [
      {
        "code": "EFFICIENCY_OUT_OF_BAND",
        "level": "warn",
        "message": "銷坪比 1.691 不在正常帶 1.58–1.68",
        "field": "efficiency_ratio"
      },
      {
        "code": "VOLUME_EXCEEDED",
        "level": "error",
        "message": "容積超出允建 31.92 m²，需調整設計",
        "field": "remaining_floor_area"
      },
      {
        "code": "SHARED_COST_LOW",
        "level": "info",
        "message": "共負比 29.7% 低於合理區間下限 30%，建議覆核參數",
        "field": "shared_cost_ratio"
      }
    ],
    "computed_at": "2026-07-01T00:00:00+00:00",
    "core_version": "0.2.0"
  },
  "provenance": {
    "core_version": "0.2.0",
    "computed_at": "2026-07-01T00:00:00+00:00",
    "input_hash": "sha256:3e38ceb1c0dd09eba3c872f46a0a7aea71d17221c1fe5f75f9ff314e20602111",
    "law_db_version": "builtin-2026-07"
  }
}